{"capabilityBundles":[{"digest":"12e6604b74413263039d55b4705e4d0e1cc3b854d7aead900d91cd9cef093e60","id":"repo-template/local-ci-contract-v2","version":"2.0.0"},{"digest":"88b0d1f44eac757962de977f4c58682f546f31d2065f113ab001e50cf53b343d","id":"repo-template/local-ci-contract-v3","version":"3.0.0"},{"digest":"69d8f6c55dbee595c2f4907085d478d2531091b37d726ef4670462c2642ee95f","id":"repo-template/proof-of-detection","version":"1.0.0"},{"digest":"6acbd065f751cd08e13d030c02a710f29f0ad7aa4daf85e5bed4e82c0ada5277","id":"repo-template/quality-lint","version":"1.1.0"},{"digest":"28c17d3287f732bfcf1bab72735f8185374f091113b83d92757a0c4680413cfe","id":"repo-template/user-surface-lint","version":"2.6.0"}],"contractId":"repo-template/adoption-shell-v2","materializer":{"artifactDigest":"80cda69178a73d7efbe736e81b87bbc16582fe68ebc2f7f8f6c9f5b77d451cd4","artifactManifestDigest":"fe3e84d70e8f1d5b75eaab996ccd76fe4f03a9740f27f2a3d15ba2853591a84e","artifactManifestPath":"artifacts/adoption-shell-v2/artifact-manifest.json","artifactManifestSchemaDigest":"b805467065d2538dc3bf21d6249eda17dd4a342a27252e12a8dea7d458256b95","artifactManifestSchemaId":"https://schemas.repo-template.dev/adoption-shell-v2/artifact-manifest.schema.json","artifactManifestSchemaVersion":"2.0.0","compatibleReleaseReceiptKind":"repo-template/release-receipt/v1","contractId":"repo-template/adoption-shell-v2","contractVersion":"2.0.0","entrypoint":"index.js","runtimeCompatibility":">=24.16.0 <25","validatorExport":"validateMaterializerInputV2"},"migrationRefs":[],"payloadSet":{"entryCount":101,"manifestDigest":"bda279ba2bbb85297e2667fcab4a37524cd7200336298c65c690bb8b3a1fe78f","manifestPath":"release/release-payload-set.json","payloadDigest":"9451d0be7295877f6a47e7d3489b9d49bdb8b0e6c78f9b58d81b1c4a9258e2b3","payloadDigestAlgorithm":"sha256-framed-path-kind-mode-content-v1","schemaDigest":"2e45fc30726def40628985347b729586ab8944c2387c1325cd2264740280733f","schemaId":"https://schemas.repo-template.dev/adoption-shell-v2/release-payload-set.schema.json","schemaVersion":"2.0.0"},"producer":{"commit":"06d055c0cbc2b085a68a4308d54162e27fb69deb","origin":"https://github.com/spencer-shadley/repo-template.git","repository":"spencer-shadley/repo-template","semver":"3.3.1","tag":"v3.3.1","tree":"1e8b655df2f668480335e3b40d4685f3ebbeba57"},"publicationState":"published","receiptDigestAlgorithm":"sha256-rfc8785-v1","receiptKind":"repo-template/release-receipt/v1","receiptTransport":{"bodyCanonicalization":"rfc8785","bodyEncoding":"utf-8","kind":"annotated-git-tag-message/v1","tagName":"v3.3.1","targetObjectType":"commit"},"releaseId":"spencer-shadley/repo-template@3.3.1","schemaDigest":"56640de35655e7eb92953cbb27a2c247f6dbf775584671d6cd052458791b7da7","schemaId":"https://schemas.repo-template.dev/adoption-shell-v2/template-release-receipt.schema.json","schemaVersion":"2.0.0","receiptDigest":"792acbe060a9dc8a03abb0ad0b5b120ae93a6014e6313e95d020cb0ba377a3da"}
