{
  "schemaId": "https://schemas.repo-template.dev/adoption-shell-v2/template-release-receipt.schema.json",
  "schemaVersion": "2.0.0",
  "schemaDigest": "56640de35655e7eb92953cbb27a2c247f6dbf775584671d6cd052458791b7da7",
  "contractId": "repo-template/adoption-shell-v2",
  "receiptKind": "repo-template/release-receipt/v1",
  "publicationState": "candidate",
  "releaseId": "spencer-shadley/repo-template@3.0.0",
  "receiptDigestAlgorithm": "sha256-rfc8785-v1",
  "producer": {
    "repository": "spencer-shadley/repo-template",
    "origin": "https://github.com/spencer-shadley/repo-template.git",
    "semver": "3.0.0",
    "tag": "v3.0.0",
    "commit": "1111111111111111111111111111111111111111",
    "tree": "2222222222222222222222222222222222222222"
  },
  "receiptTransport": {
    "kind": "annotated-git-tag-message/v1",
    "tagName": "v3.0.0",
    "targetObjectType": "commit",
    "bodyEncoding": "utf-8",
    "bodyCanonicalization": "rfc8785"
  },
  "payloadSet": {
    "manifestPath": "release/release-payload-set.json",
    "schemaId": "https://schemas.repo-template.dev/adoption-shell-v2/release-payload-set.schema.json",
    "schemaVersion": "2.0.0",
    "schemaDigest": "2e45fc30726def40628985347b729586ab8944c2387c1325cd2264740280733f",
    "manifestDigest": "3333333333333333333333333333333333333333333333333333333333333333",
    "payloadDigestAlgorithm": "sha256-framed-path-kind-mode-content-v1",
    "payloadDigest": "4444444444444444444444444444444444444444444444444444444444444444",
    "entryCount": 1
  },
  "capabilityBundles": [
    {
      "id": "repo-template/user-surface-lint",
      "version": "2.6.0",
      "digest": "28c17d3287f732bfcf1bab72735f8185374f091113b83d92757a0c4680413cfe"
    }
  ],
  "materializer": {
    "contractId": "repo-template/adoption-shell-v2",
    "contractVersion": "2.0.0",
    "artifactManifestPath": "artifacts/adoption-shell-v2/artifact-manifest.json",
    "artifactManifestSchemaId": "https://schemas.repo-template.dev/adoption-shell-v2/artifact-manifest.schema.json",
    "artifactManifestSchemaVersion": "2.0.0",
    "artifactManifestSchemaDigest": "b805467065d2538dc3bf21d6249eda17dd4a342a27252e12a8dea7d458256b95",
    "artifactManifestDigest": "5555555555555555555555555555555555555555555555555555555555555555",
    "artifactDigest": "6666666666666666666666666666666666666666666666666666666666666666",
    "entrypoint": "index.js",
    "validatorExport": "validateMaterializerInputV2",
    "runtimeCompatibility": ">=24.16.0 <25",
    "compatibleReleaseReceiptKind": "repo-template/release-receipt/v1"
  },
  "releaseEvidence": {
    "review": {
      "subject": "producer-commit",
      "url": "https://github.com/spencer-shadley/repo-template/pull/111#pullrequestreview-4815250857",
      "result": "approved"
    },
    "canaryReceipts": {
      "model-gateway-v1": {
        "url": "https://github.com/spencer-shadley/model-gateway/issues/21#issuecomment-5120000001",
        "receiptSha256": "aaaaaaaaaaaaaaaaaaaaaaaaaaaaaaaaaaaaaaaaaaaaaaaaaaaaaaaaaaaaaaaa"
      },
      "repo-factory-v1": {
        "url": "https://github.com/spencer-shadley/repo-factory/issues/1#issuecomment-5120000002",
        "receiptSha256": "bbbbbbbbbbbbbbbbbbbbbbbbbbbbbbbbbbbbbbbbbbbbbbbbbbbbbbbbbbbbbbbb"
      }
    },
    "checks": {
      "repo-template-verify": {
        "command": "corepack.cmd pnpm verify",
        "result": "passed"
      }
    },
    "publicationReadback": {
      "kind": "producer-tag-ref/v1"
    },
    "rollback": {
      "disposition": "immutable-correct-forward",
      "supersession": "new-semver-only"
    }
  },
  "migrationRefs": [],
  "receiptDigest": "ab3d0686283391af836565f3d2501f257ef1caefcbdf987615e5771c7a244174"
}
